<?xml version="1.0" encoding="UTF-8" standalone="no"?>
<!-- PYCSW_VERSION -->
<csw30:GetDomainResponse xmlns:csw="http://www.opengis.net/cat/csw/2.0.2" xmlns:csw30="http://www.opengis.net/cat/csw/3.0" xmlns:dc="http://purl.org/dc/elements/1.1/" xmlns:dct="http://purl.org/dc/terms/" xmlns:gmd="http://www.isotc211.org/2005/gmd" xmlns:gml="http://www.opengis.net/gml" xmlns:ows="http://www.opengis.net/ows" xmlns:xs="http://www.w3.org/2001/XMLSchema" xmlns:xsi="http://www.w3.org/2001/XMLSchema-instance" xsi:schemaLocation="http://www.opengis.net/cat/csw/3.0 http://schemas.opengis.net/csw/3.0/cswGetDomain.xsd">
  <csw30:DomainValues resultType="available" type="csw30:Record">
    <csw30:ValueReference>dc:title</csw30:ValueReference>
    <csw30:ListOfValues>
      <csw30:Value count="1">Aliquam fermentum purus quis arcu</csw30:Value>
      <csw30:Value count="1">Fuscé vitae ligulä</csw30:Value>
      <csw30:Value count="1">Lorem ipsum</csw30:Value>
      <csw30:Value count="1">Lorem ipsum dolor sit amet</csw30:Value>
      <csw30:Value count="1">Maecenas enim</csw30:Value>
      <csw30:Value count="1">Mauris sed neque</csw30:Value>
      <csw30:Value count="1">Ut facilisis justo ut lacus</csw30:Value>
      <csw30:Value count="1">Vestibulum massa purus</csw30:Value>
      <csw30:Value count="1">Ñunç elementum</csw30:Value>
    </csw30:ListOfValues>
  </csw30:DomainValues>
</csw30:GetDomainResponse>
